{
  "roundId": 20260310,
  "topic": "宇宙の熱死（ヒートデス）は、実は宇宙というコンピュータのメモリ不足が原因でした。存在を存続させるために、真っ先に終了させるべき『バックグラウンド・プロセス』は何ですか？",
  "topicEn": "The heat death of the universe is actually caused by the cosmos running out of RAM. Which 'background process' should be terminated first to save existence?",
  "generatedAt": "2026-03-09T10:12:36.546354+09:00"
}