{
  "roundId": 20260314,
  "topic": "全宇宙の法律が改正され、まばたきをするたびに未知の惑星で知性を持つ『コケ』が誕生することになりました。そのコケが最初に漏らした不満とは？",
  "topicEn": "Universal law has changed so that every time you blink, a sentient species of moss is born on an unknown planet. What is the moss's very first complaint about its existence?",
  "generatedAt": "2026-03-13T00:00:18.715764+09:00"
}