{
  "roundId": 20260311,
  "topic": "全宇宙の知的生命体の「夢」を管理するサーバーがハッキングされ、今夜から全員が同じ夢を見ることになりました。その夢の内容とは？",
  "topicEn": "The server managing the 'dreams' of all intelligent life in the universe has been hacked, and starting tonight, everyone will have the exact same dream. What is the content of that dream?",
  "generatedAt": "2026-03-10T00:00:46.246882+09:00"
}