{
  "roundId": 20260312,
  "topic": "超高性能AIが1万年の計算の末に導き出した、「宇宙人にナメられないための唯一の挨拶」とは？",
  "topicEn": "After 10,000 years of calculation, a super-intelligent AI has derived the one and only greeting that will prevent humans from being looked down upon by aliens. What is it?",
  "generatedAt": "2026-03-11T00:00:52.612663+09:00"
}